{
  "$schema": "http://json-schema.org/draft-07/schema#",
  "title": "Statistics",
  "type": "object",
  "required": ["schema_version", "updated_at", "summary", "items"],
  "properties": {
    "schema_version": { "type": "integer" },
    "updated_at": { "type": "string" },
    "summary": { "type": "object" },
    "items": { "type": "array" }
  }
}
