{
  "schema_version": 1,
  "updated_at": "2026-09-21T16:00:00+07:00",
  "summary": {
    "total_projects": 20,
    "total_cost": 29,
    "total_reward": 0,
    "total_revenue": 0,
    "total_profit": -29,
    "total_roi": -100,
    "realized": 0,
    "pending": 20,
    "unrealized": 20
  },
  "items": [
    {
      "project_id": "startale",
      "project_name": "Startale",
      "cost": 2,
      "reward": 0,
      "revenue": 0,
      "profit": -2,
      "roi": -100,
      "currency": "USD",
      "status": "pending",
      "updated_at": "2026-09-21"
    },
    {
      "project_id": "rep",
      "project_name": "REP",
      "cost": 1,
      "reward": 0,
      "revenue": 0,
      "profit": -1,
      "roi": -100,
      "currency": "USD",
      "status": "pending",
      "updated_at": "2026-09-21"
    },
    {
      "project_id": "loaf_markets",
      "project_name": "Loaf Markets",
      "cost": 1,
      "reward": 0,
      "revenue": 0,
      "profit": -1,
      "roi": -100,
      "currency": "USD",
      "status": "pending",
      "updated_at": "2026-09-21"
    },
    {
      "project_id": "elyon_chain",
      "project_name": "Elyon Chain",
      "cost": 1,
      "reward": 0,
      "revenue": 0,
      "profit": -1,
      "roi": -100,
      "currency": "USD",
      "status": "pending",
      "updated_at": "2026-09-21"
    },
    {
      "project_id": "amadeus",
      "project_name": "Amadeus",
      "cost": 2,
      "reward": 0,
      "revenue": 0,
      "profit": -2,
      "roi": -100,
      "currency": "USD",
      "status": "pending",
      "updated_at": "2026-09-21"
    },
    {
      "project_id": "rialo",
      "project_name": "Rialo",
      "cost": 0,
      "reward": 0,
      "revenue": 0,
      "profit": 0,
      "roi": null,
      "currency": "USD",
      "status": "pending",
      "updated_at": "2026-09-21"
    },
    {
      "project_id": "dac",
      "project_name": "DAC",
      "cost": 0,
      "reward": 0,
      "revenue": 0,
      "profit": 0,
      "roi": null,
      "currency": "USD",
      "status": "pending",
      "updated_at": "2026-09-21"
    },
    {
      "project_id": "forecast",
      "project_name": "Forecast",
      "cost": 1,
      "reward": 0,
      "revenue": 0,
      "profit": -1,
      "roi": -100,
      "currency": "USD",
      "status": "pending",
      "updated_at": "2026-09-21"
    },
    {
      "project_id": "agentum",
      "project_name": "Agentum",
      "cost": 2,
      "reward": 0,
      "revenue": 0,
      "profit": -2,
      "roi": -100,
      "currency": "USD",
      "status": "pending",
      "updated_at": "2026-09-21"
    },
    {
      "project_id": "fliptfun_testnet",
      "project_name": "Fliptfun Testnet",
      "cost": 2,
      "reward": 0,
      "revenue": 0,
      "profit": -2,
      "roi": -100,
      "currency": "USD",
      "status": "pending",
      "updated_at": "2026-09-21"
    },
    {
      "project_id": "raycash",
      "project_name": "Raycash",
      "cost": 1,
      "reward": 0,
      "revenue": 0,
      "profit": -1,
      "roi": -100,
      "currency": "USD",
      "status": "pending",
      "updated_at": "2026-09-21"
    },
    {
      "project_id": "kaleidofi",
      "project_name": "KaleidoFi",
      "cost": 2,
      "reward": 0,
      "revenue": 0,
      "profit": -2,
      "roi": -100,
      "currency": "USD",
      "status": "pending",
      "updated_at": "2026-09-21"
    },
    {
      "project_id": "arccats",
      "project_name": "ArcCats",
      "cost": 2,
      "reward": 0,
      "revenue": 0,
      "profit": -2,
      "roi": -100,
      "currency": "USD",
      "status": "pending",
      "updated_at": "2026-09-21"
    },
    {
      "project_id": "lake_energy",
      "project_name": "Lake Energy",
      "cost": 1,
      "reward": 0,
      "revenue": 0,
      "profit": -1,
      "roi": -100,
      "currency": "USD",
      "status": "pending",
      "updated_at": "2026-09-21"
    },
    {
      "project_id": "earnlist",
      "project_name": "EarnList",
      "cost": 0,
      "reward": 0,
      "revenue": 0,
      "profit": 0,
      "roi": null,
      "currency": "USD",
      "status": "pending",
      "updated_at": "2026-09-21"
    },
    {
      "project_id": "derpetual",
      "project_name": "Derpetual",
      "cost": 1,
      "reward": 0,
      "revenue": 0,
      "profit": -1,
      "roi": -100,
      "currency": "USD",
      "status": "pending",
      "updated_at": "2026-09-21"
    },
    {
      "project_id": "xdao",
      "project_name": "XDAO",
      "cost": 0,
      "reward": 0,
      "revenue": 0,
      "profit": 0,
      "roi": null,
      "currency": "USD",
      "status": "pending",
      "updated_at": "2026-09-21"
    },
    {
      "project_id": "allscale",
      "project_name": "AllScale",
      "cost": 2,
      "reward": 0,
      "revenue": 0,
      "profit": -2,
      "roi": -100,
      "currency": "USD",
      "status": "pending",
      "updated_at": "2026-09-21"
    },
    {
      "project_id": "czr_genesis_airdrop",
      "project_name": "CZR Genesis Airdrop",
      "cost": 5,
      "reward": 0,
      "revenue": 0,
      "profit": -5,
      "roi": -100,
      "currency": "USD",
      "status": "pending",
      "updated_at": "2026-09-21"
    },
    {
      "project_id": "asentum",
      "project_name": "Asentum",
      "cost": 3,
      "reward": 0,
      "revenue": 0,
      "profit": -3,
      "roi": -100,
      "currency": "USD",
      "status": "pending",
      "updated_at": "2026-09-21"
    }
  ]
}